ACCESSION_NUMBER	REGULATORYAGENCY	ENTITYNAME	PREVIOUSENTITYNAME	FINSNUMBER	DIFFERENTMAILINGADDRESS	TELEPHONENUMBER	CONDUCTBUSINESSINOTHERLOCATION	SELFTRANSFERAGENT	ENGAGEDSERVICECOMPANY	ENGAGEDASSERVICECOMPANY	REGISTRANTTYPE	REGISTRANTTYPEDESCRIPTION	OTHERCONTROLMANAGEMENT	OTHERCONTROLFINANCE	FELONYORMISDEMEANOR	OTHERFELONY	ENJOINEDINVESTRELATEDACTIVITY	VIOLATIONINVRELATEDREGULATION	FALSESTATEMENTOROMISSION	VIOLATIONOFREGULATIONS	AUTHORIZATIONDENIEDORSUSPENDED	REGISTRATIONDENIEDORSUSPENDED	FSRFALSESTATEMENTOROMISSION	FSRVIOLATEINVRELATEDREGULATION	FSRAUTHORIZEDENIEDORSUSPENDED	FSRFOUNDORDERAGAINSTAPPLICANT	FSRREGISTRATIONDENIEDSUSPENDED	FSRREVOKEDSUSPENDEDLICENSE	SRAFALSESTATEMENTOROMISSION	SRAVIOLATIONOFRULES	SRAAUTHORIZEDENIEDORSUSPENDED	SRAREVOKEDSUSPENDEDLICENSE	FOREIGNAGENCY	SUBJECTOFPROCEEDINGS	REVOKEDBOND	UNSATISFIEDJUDGEMENTSORLIENS
0001465533-22-000006	SEC	Delaware Trust Co	CSC Trust Co of Delaware	340349	Y	302-636-5851	N	N	N	N	Corporation		Y	N	N	N	N	N	N	N	N	N	N	N	N	N	N	N	N	N	N	N	N	N	N	N
0001931822-22-000002	SEC	SUNNAH & JAMES MNYANDU ESTATE TRUST		371112	N	551 333-1035	N	Y	N	N	Other	Trust	N	N	N	N	N	N	N	N	N	N	N	N	N	N	N	N	N	N	N	N	N	N	N	N
0001018490-22-000020	SEC	DB SERVICES AMERICAS INC /TA	DB SERVICES TENNESSEE INC /TA	955203	N	(800) 735-7777	N	N	N	Y	Corporation		Y	Y	Y	Y	Y	Y	Y	Y	N	Y	Y	Y	N	Y	N	N	Y	Y	N	N	Y	Y	N	N
0000769188-22-000006	SEC	MFS SERVICE CENTER, INC.	MFS SERVICE CENTER INC /TA	407387	N	(617) 954-5000	N	Y	Y	N	Corporation		Y	N	N	N	N	N	Y	Y	N	N	Y	Y	N	N	Y	N	N	N	N	N	N	N	N	N
0000842657-22-000011	SEC	DWS Service Co	Deutsche AM Service Co	417949	N	212-250-2500	N	Y	Y	N	Corporation		N	N	Y	Y	Y	Y	Y	Y	N	Y	Y	Y	N	Y	N	N	Y	Y	N	N	Y	Y	N	N
0001062993-22-014934	SEC	TSX Trust Co	AST Trust Co (Canada)	283580	N	4166077947	Y	N	Y	Y	Corporation		N	N	N	N	N	N	N	N	N	N	N	N	N	N	N	N	N	N	N	N	N	N	N	N
0001465533-22-000005	SEC	Delaware Trust Co	CSC Trust Co of Delaware	340349	Y	302-636-5851	N	N	N	N	Corporation		Y	N	N	N	N	N	N	N	N	N	N	N	N	N	N	N	N	N	N	N	N	N	N	N
0001419454-22-000004	SEC	Fidelity Business Services India Private Ltd	Fidelity Business Services India Private LTD	334318	Y	401-292-6071	Y	N	N	Y	Corporation		Y	Y	N	N	N	N	Y	Y	N	N	N	Y	N	N	N	N	N	Y	N	N	Y	N	N	N
0001018490-22-000018	SEC	DB SERVICES AMERICAS INC /TA	DB SERVICES TENNESSEE INC /TA	955203	N	(800) 735-7777	N	N	N	Y	Corporation		Y	Y	Y	Y	Y	Y	Y	Y	N	Y	Y	Y	N	Y	N	N	Y	Y	N	N	Y	Y	N	N
0001718015-22-000006	SEC	Odyssey Trust Co		354050	N	587-885-0960	Y	N	Y	Y	Corporation		N	N	N	N	N	N	N	N	N	N	N	N	N	N	N	N	N	N	N	N	N	N	N	N
0000913181-22-000003	SEC	MUFG Investor Services (US) LLC	MUFG Investor Services (US), LLC	269647	N	240-614-4800	N	N	N	N	Other	Limited Liability Company	Y	N	N	N	N	N	N	Y	N	N	N	Y	N	N	N	N	N	Y	N	N	Y	N	N	N
0001830271-22-000008	SEC	BlockQuake Transfer Agent, LLC		003678	N	646-657-1712	N	N	N	N	Other	Limited Liability Company	Y	N	N	N	N	N	N	N	N	N	N	N	N	N	N	N	N	N	N	N	N	N	N	N
0001667731-22-000236	SEC	Integral Transfer Agency USA, Inc.		346247	N	716-402-8539	Y	N	Y	N	Corporation		Y	N	Y	N	N	N	N	N	N	N	N	N	N	N	N	N	N	N	N	N	N	N	N	N
0001794142-22-000006	SEC	INX Transfer Agent, LLC	Tokensoft Transfer Agent LLC	003653	N	240-404-8254	N	N	N	N	Other	LLC	Y	Y	N	N	N	N	N	N	N	N	N	N	N	N	N	N	N	N	N	N	N	N	N	N
0001922806-22-000004	SEC	SMBX Transfer Agent LLC		003704	N	2138044693	N	N	N	N	Other	LLC	Y	Y	N	N	N	N	N	N	N	N	N	N	N	N	N	N	N	N	N	N	N	N	N	N
0001000952-22-000004	SEC	CONDUENT SECURITIES SERVICES INC /TA	ACS SECURITIES SERVICES INC /TA	483644	N	214-887-7398	N	N	N	N	Corporation		N	N	N	N	N	N	N	N	N	N	N	N	N	N	N	N	N	N	N	N	N	N	N	N
0000920888-22-000005	SEC	ANDESA SERVICES, INC. /TA	ANDESA TPA INC                                          /TA	470047	N	610-821-8980	N	Y	N	N	Corporation		N	N	N	N	N	N	N	N	N	N	N	Y	N	N	N	Y	N	N	N	N	N	N	N	N
0001557183-22-000001	SEC	ASCENSUS COLLEGE SAVINGS RECORDKEEPING SERVICES LLC	UPROMISE INVESTMENTS RECORDKEEPING SERVICES LLC	347856	N	215-648-1272	Y	N	Y	N	Other	LLC	Y	N	N	N	N	N	N	N	N	N	N	N	N	N	N	N	N	N	N	N	N	N	N	N
0001930890-22-000001	SEC	Beneficient Transfer & Clearing Company, L.L.C./TA		370759	N	6202732582	Y	Y	N	N	Not Applicable				N	N	N	N	N	N	N	N	N	N	N	N	N	N	N	N	N	N	N	N	N	N
0001451217-22-000008	SEC	SEI Institutional Transfer Agent, Inc.		339341	N	800-858-7233	N	N	N	N	Corporation		N	N	N	N	N	N	N	Y	N	N	N	N	N	N	N	N	N	Y	N	N	Y	N	N	N
0001559963-22-000003	SEC	BNY Mellon International Operations (India) Private Ltd		347971	N	412-234-6365	Y	N	N	Y	Corporation		N	N	Y	N	Y	N	Y	Y	Y	Y	N	Y	N	Y	Y	N	Y	Y	N	N	Y	Y	N	N
0001424912-22-000007	SEC	se2, LLC/TA	se2, inc./TA	336479	N	785-438-3000	N	N	N	Y	Other	Limited Liability Company	N	N	N	N	N	N	N	N	N	N	N	Y	N	N	Y	N	N	Y	N	N	N	N	N	N
0000733598-22-000003	SEC	ALLIANCEBERNSTEIN INVESTOR SERVICES INC /TA	ALLIANCE FUND SERVICES INC                              /TA	407254	N	210-384-6000	Y	Y	N	N	Corporation		Y	N	N	N	N	N	N	N	N	N	N	N	N	N	N	N	N	N	N	N	N	N	N	N
0001492746-22-000006	SEC	NAV Consulting, Inc.		342816	N	630-954-1919	Y	N	N	N	Corporation		N	N	N	N	N	N	N	N	N	N	N	N	N	N	N	N	N	N	N	N	N	N	N	N
0000080255-22-002339	SEC	PRICE ROWE T SERVICES INC                               /TA		408005	Y	4103456787	Y	N	N	N	Not Applicable		N	N	N	N	N	N	N	Y	N	N	N	Y	N	N	N	N	N	Y	N	N	N	N	N	N
0001104659-22-058159	SEC	MADISON STOCK TRANSFER INC /TA		491704	Y	718-627-4453	N	N	Y	N	Corporation		N	N	N	N	Y	N	N	N	N	N	N	N	N	N	N	N	N	N	N	N	N	N	N	Y
0001419454-22-000003	SEC	Fidelity Business Services India Private Ltd	Fidelity Business Services India Private LTD	334318	Y	401-292-6071	Y	N	N	Y	Corporation		Y	Y	N	N	N	N	Y	Y	N	N	N	Y	N	N	N	N	N	Y	N	N	Y	N	N	N
0000849542-22-000004	SEC	BNY Mellon Investment Servicing (US) Inc.	PNC Global Investment Servicing (U.S.) Inc.	418772	N	508-871-8500	Y	N	Y	Y	Corporation		N	N	Y	N	Y	N	Y	Y	Y	Y	N	Y	N	Y	Y	N	Y	Y	N	N	Y	Y	N	N
0000823579-22-000003	SEC	COLONIAL STOCK TRANSFER CO INC /TA	COLONIAL STOCK TRANSFER CO INC                          /TA	410506	N	8013555740	N	N	N	N	Corporation		N	N	N	N	N	N	N	N	N	N	N	N	N	N	N	N	N	N	N	N	N	N	N	N
0001285911-22-000002	SEC	BNY MELLON TRANSFER INC	BNY Mellon Transfer, Inc.	482448	Y	212-922-7075	N	N	Y	N	Corporation		N	N	Y	N	Y	N	Y	Y	Y	Y	N	Y	N	Y	Y	N	Y	Y	N	N	Y	Y	N	N
0000896852-22-000010	SEC	INVESCO INVESTMENT SERVICES INC	INVESCO AIM INVESTMENT SERVICES INC	453936	Y	713-626-1919	N	N	Y	N	Corporation		N	N	N	N	N	N	Y	Y	N	N	Y	Y	N	N	N	N	N	Y	N	N	Y	Y	N	N
0000353291-22-000008	SEC	FRANKLIN TEMPLETON INVESTOR SERVICES LLC /TA	FRANKLIN TEMPLETON INVESTOR SERVICES INC                /TA	404665	N	916-463-2075	Y	N	Y	N	Other	Limited Liability Company	Y	N	N	N	N	N	Y	Y	N	N	Y	Y	N	N	N	N	N	N	N	N	Y	N	N	N
0001146230-22-000007	SEC	Computershare Inc /TA	Computershare Shareholder Services Inc /TA	260539	N	781-575-2000	Y	N	Y	Y	Corporation		N	N	N	N	N	N	N	Y	N	Y	N	N	N	N	Y	N	N	Y	N	N	N	Y	N	N
0000842657-22-000009	SEC	DWS Service Co	Deutsche AM Service Co	417949	N	212-250-2500	N	Y	Y	N	Corporation		N	N	Y	Y	Y	Y	Y	Y	N	Y	Y	Y	N	Y	N	N	Y	Y	N	N	Y	Y	N	N
0001018490-22-000015	SEC	DB SERVICES AMERICAS INC /TA	DB SERVICES TENNESSEE INC /TA	955203	N	(800) 735-7777	N	N	N	Y	Corporation		Y	Y	Y	Y	Y	Y	Y	Y	N	Y	Y	Y	N	Y	N	N	Y	Y	N	N	Y	Y	N	N
0001559963-22-000002	SEC	BNY Mellon International Operations (India) Private Ltd		347971	N	412-234-6365	Y	N	N	Y	Corporation		N	N	Y	N	Y	N	Y	Y	Y	Y	N	Y	N	Y	Y	N	Y	Y	N	N	Y	Y	N	N
0001018490-22-000013	SEC	DB SERVICES AMERICAS INC /TA	DB SERVICES TENNESSEE INC /TA	955203	N	(800) 735-7777	N	N	N	Y	Corporation		Y	Y	Y	Y	Y	Y	Y	Y	N	Y	Y	Y	N	Y	N	N	Y	Y	N	N	Y	Y	N	N
0001718015-22-000003	SEC	Odyssey Trust Co		354050	N	587-885-0960	Y	N	Y	Y	Corporation		N	N	N	N	N	N	N	N	N	N	N	N	N	N	N	N	N	N	N	N	N	N	N	N
0001921936-22-000002	SEC	Ohanae Inc		370551	N	888-617-7288	N	N	N	N	Corporation		N	N	N	N	N	N	N	N	N	N	N	N	N	N	N	N	N	N	N	N	N	N	N	N
0001903596-22-000157	SEC	Capital Transfer Agency, Ulc	Capital Transfer Agency, Inc.	292110	N	416-350-5007	N	N	N	N	Corporation		N	N	N	N	N	N	N	N	N	N	N	N	N	N	N	N	N	N	N	N	N	N	N	N
0001915430-22-000003	SEC	Dinari, Inc/TA		369967	N	3107091430	N	N	N	N	Corporation		N	N	N	N	N	N	N	N	N	N	N	N	N	N	N	N	N	N	N	N	N	N	N	N
0001920641-22-000001	SEC	DigiShares TA, LLC / TA		370569	N	9173855872	N	N	N	N	Partnership		Y	N	N	N	N	N	N	N	N	N	N	N	N	N	N	N	N	N	N	N	N	N	N	N
0001202048-22-000006	SEC	VALIC RETIREMENT SERVICES CO	AIG RETIREMENT SERVICES CO	502575	N	713-831-3150	N	N	N	N	Corporation		Y	N	N	N	N	N	Y	Y	N	N	Y	Y	N	Y	N	N	N	Y	N	N	N	N	N	N
