ACCESSION_NUMBER	REGULATORYAGENCY	ENTITYNAME	PREVIOUSENTITYNAME	FINSNUMBER	DIFFERENTMAILINGADDRESS	TELEPHONENUMBER	CONDUCTBUSINESSINOTHERLOCATION	SELFTRANSFERAGENT	ENGAGEDSERVICECOMPANY	ENGAGEDASSERVICECOMPANY	REGISTRANTTYPE	REGISTRANTTYPEDESCRIPTION	OTHERCONTROLMANAGEMENT	OTHERCONTROLFINANCE	FELONYORMISDEMEANOR	OTHERFELONY	ENJOINEDINVESTRELATEDACTIVITY	VIOLATIONINVRELATEDREGULATION	FALSESTATEMENTOROMISSION	VIOLATIONOFREGULATIONS	AUTHORIZATIONDENIEDORSUSPENDED	REGISTRATIONDENIEDORSUSPENDED	FSRFALSESTATEMENTOROMISSION	FSRVIOLATEINVRELATEDREGULATION	FSRAUTHORIZEDENIEDORSUSPENDED	FSRFOUNDORDERAGAINSTAPPLICANT	FSRREGISTRATIONDENIEDSUSPENDED	FSRREVOKEDSUSPENDEDLICENSE	SRAFALSESTATEMENTOROMISSION	SRAVIOLATIONOFRULES	SRAAUTHORIZEDENIEDORSUSPENDED	SRAREVOKEDSUSPENDEDLICENSE	FOREIGNAGENCY	SUBJECTOFPROCEEDINGS	REVOKEDBOND	UNSATISFIEDJUDGEMENTSORLIENS
0001718015-20-000004	SEC	Odyssey Trust Co		354050	N	778-819-1184	Y	N	Y	Y	Corporation		N	N	N	N	N	N	N	N	N	N	N	N	N	N	N	N	N	N	N	N	N	N	N	N
0001825597-20-000001	SEC	BRITE Records, LLC		367243	N	3219486021	N	N	N	N	Other	Limited Liability Company	N	N	N	N	N	N	N	N	N	N	N	N	N	N	N	N	N	N	N	N	N	N	N	N
0001465533-20-000006	SEC	Delaware Trust Co	CSC Trust Co of Delaware	340349	Y	302-636-5851	N	N	Y	N	Corporation		Y	N	N	N	N	N	N	N	N	N	N	N	N	N	N	N	N	N	N	N	N	N	N	N
0001007444-20-000012	SEC	LPL Financial LLC /TA	LPL Financial CORP /TA	008698	Y	800-877-7210	N	N	N	N	Other	LLC	Y	N	N	N	N	N	Y	Y	N	Y	Y	Y	N	Y	Y	N	Y	Y	N	N	N	N	Y	N
0001823412-20-000005	SEC	IHSAN DARIUSH IBRAHIM GHOLIZADEH TRANSFER TRUST	IHSAN DARIUSH IBRAHIM GHOLIZADEH TRUST- TA	367276	N	3025819435	N	Y	N	N	Not Applicable		N	N	N	N	N	N	N	N	N	N	N	N	N	N	N	N	N	N	N	N	N	N	N	N
0001432531-20-000008	SEC	Franklin Templeton International Services (India) Private LTD		335091	Y	916-463-4350	N	N	N	Y	Other	Private Limited Company	Y	N	N	N	N	N	Y	Y	N	N	Y	Y	N	Y	N	N	N	N	N	N	Y	N	N	N
0001458682-20-000002	SEC	ClearTrust, LLC		340034	N	813-235-4490	N	N	N	Y	Other	Limited Liability Company	N	Y	N	N	N	N	N	N	N	N	N	N	N	N	N	N	N	N	N	N	N	N	N	N
0000842657-20-000008	SEC	DWS Service Co	Deutsche AM Service Co	417949	N	212-250-2500	N	Y	Y	N	Corporation		N	N	Y	Y	Y	Y	Y	Y	N	Y	Y	Y	N	Y	N	N	Y	Y	N	N	Y	Y	N	N
0001432532-20-000006	SEC	Franklin Templeton Investments Poland sp. z.o.o.		335083	Y	916-463-4350	N	N	N	Y	Other	Limited Liability Company	Y	N	N	N	N	N	Y	Y	N	N	Y	Y	N	Y	N	N	N	N	N	N	Y	N	N	N
0001451316-20-000011	SEC	Franklin Templeton Investment Services GmbH		339135	Y	916-463-4350	N	N	N	Y	Other	Limited Liability Company	Y	N	N	N	N	N	Y	Y	N	N	Y	Y	N	Y	N	N	N	N	N	N	Y	N	N	N
0000353291-20-000005	SEC	FRANKLIN TEMPLETON INVESTOR SERVICES LLC /TA	FRANKLIN TEMPLETON INVESTOR SERVICES INC                /TA	404665	N	916-463-4350	Y	N	Y	N	Other	Limited Liability Company	Y	N	N	N	N	N	Y	Y	N	N	Y	Y	N	Y	N	N	N	N	N	N	Y	N	N	N
0001822070-20-000002	SEC	Parker Transfer Agency, Inc		367029	N	7166399090	Y	Y	N	N	Corporation		N	N	N	N	N	N	N	N	N	N	N	N	N	N	N	N	N	N	N	N	N	N	N	N
0001821782-20-000002	SEC	WENDY ELIZABETH SILL TRUST		367177	N	310-490-4653	N	Y	N	N	Corporation		N	N	N	N	N	N	N	N	N	N	N	N	N	N	N	N	N	N	N	N	N	N	N	N
0001821222-20-000002	SEC	CHRISTOPHER WAYNE REID TRUST		367094	N	954-588-6887	N	Y	N	N	Corporation		N	N	N	N	N	N	N	N	N	N	N	N	N	N	N	N	N	N	N	N	N	N	N	N
0001451217-20-000007	SEC	SEI Institutional Transfer Agent, Inc.		339341	N	800-858-7233	N	N	N	N	Corporation		N	N	N	N	N	N	N	Y	N	N	N	N	N	N	N	N	N	Y	N	N	Y	N	N	N
0001477932-20-005250	SEC	Southern Stock Transfer Co LLC		365510	N	912-223-0108	N	N	N	N	Other	Limited Liability Company	N	N	N	N	N	N	N	N	N	N	N	N	N	N	N	N	N	N	N	N	N	N	N	N
0001030030-20-000005	SEC	NOTTINGHAM SHAREHOLDER SERVICES LLC /TA	NORTH CAROLINA SHAREHOLDER SERVICES LLC /TA	028878	Y	800-773-3863	N	N	Y	N	Other	LLC	Y	N	N	N	N	N	N	Y	N	Y	N	N	N	N	N	N	N	N	N	N	N	N	N	N
0000817712-20-000010	SEC	THRIVENT FINANCIAL INVESTOR SERVICES INC /TA		473165	Y	612-844-4581	N	Y	Y	N	Corporation		Y	N	N	N	N	N	N	N	N	N	N	Y	N	Y	N	N	N	Y	N	N	N	N	N	N
0001822306-20-000001	SEC	NATASHA MICHELLE BOYLAND TRUST		367003	N	888-292-6697	N	Y	N	N	Corporation		N	N	N	N	N	N	N	N	N	N	N	N	N	N	N	N	N	N	N	N	N	N	N	N
0001202048-20-000012	SEC	VALIC RETIREMENT SERVICES CO	AIG RETIREMENT SERVICES CO	502575	N	713-831-3150	N	N	N	N	Corporation		Y	N	N	N	N	N	Y	Y	N	N	Y	Y	Y	Y	Y	Y	Y	Y	Y	Y	N	N	N	N
0001288777-20-000004	SEC	Computershare Trust Co of Canada		298181	N	4162639659	Y	N	Y	Y	Corporation		N	N	N	N	N	N	N	Y	N	Y	N	N	N	N	Y	N	N	Y	N	N	N	Y	N	N
0001288763-20-000017	SEC	Computershare Investor Services Inc		289645	N	4162639659	Y	N	Y	Y	Corporation		N	N	N	N	N	N	N	Y	N	Y	N	N	N	N	Y	N	N	Y	N	N	N	Y	N	N
0001432531-20-000007	SEC	Franklin Templeton International Services (India) Private LTD		335091	Y	916-463-4350	N	N	N	Y	Other	Private Limited Company	Y	N	N	N	N	N	Y	Y	N	N	Y	Y	N	Y	N	N	N	N	N	N	Y	N	N	N
0001214659-20-007341	SEC	Vail Stock Transfer		003655	Y	702-463-8832	N	N	N	N	Corporation		N	N	N	N	N	N	N	N	N	N	N	N	N	N	N	N	N	N	N	N	N	N	N	N
0000842657-20-000007	SEC	DB SERVICES AMERICAS INC /TA	DB SERVICES TENNESSEE INC /TA	955203	N	(800) 735-7777	N	N	N	Y	Corporation		Y	Y	Y	Y	Y	Y	Y	Y	N	Y	Y	Y	N	Y	N	N	Y	Y	N	N	Y	Y	N	N
0001419454-20-000007	SEC	Fidelity Business Services India Private Ltd	Fidelity Business Services India Private LTD	334318	Y	617-563-1492	Y	N	N	Y	Corporation		Y	Y	N	N	N	N	Y	Y	N	N	N	Y	N	N	N	N	N	Y	N	N	Y	N	N	N
0001133702-20-000011	SEC	NATIONAL FINANCIAL SERVICES LLC /TA		061671	Y	617-563-1492	Y	N	N	Y	Corporation		N	N	N	N	N	N	Y	Y	N	N	N	Y	N	N	N	N	N	Y	N	N	Y	N	N	N
0000862124-20-000012	SEC	FIDELITY INVESTMENTS INSTITUTIONAL OPERATIONS CO LLC	FIDELITY INVESTMENTS WESTERN SERVICES CO INC            /TA	428219	Y	6175631492	Y	N	Y	N	Corporation		N	N	N	N	N	N	Y	Y	N	N	N	Y	N	N	N	N	N	Y	N	N	Y	N	N	N
0001451316-20-000010	SEC	Franklin Templeton Investment Services GmbH		339135	Y	916-463-4350	N	N	N	Y	Other	Limited Liability Company	Y	N	N	N	N	N	Y	Y	N	N	Y	Y	N	Y	N	N	N	N	N	N	Y	N	N	N
0000353291-20-000004	SEC	FRANKLIN TEMPLETON INVESTOR SERVICES LLC /TA	FRANKLIN TEMPLETON INVESTOR SERVICES INC                /TA	404665	N	916-463-4350	Y	N	Y	N	Other	Limited Liability Company	Y	N	N	N	N	N	Y	Y	N	N	Y	Y	N	Y	N	N	N	N	N	N	Y	N	N	N
0001432532-20-000005	SEC	Franklin Templeton Investments Poland sp. z.o.o.		335083	Y	916-463-4350	N	N	N	Y	Other	Limited Liability Company	Y	N	N	N	N	N	Y	Y	N	N	Y	Y	N	Y	N	N	N	N	N	N	Y	N	N	N
0001049169-20-000013	SEC	ALPS FUND SERVICES, INC.	ALPS FUNDS SERVICES INC /CO/ /TA	332981	N	303-623-2577	N	N	N	N	Corporation		Y	N	N	N	N	N	N	Y	N	N	N	Y	N	N	Y	N	N	Y	N	N	N	N	N	N
0001787835-20-000005	SEC	Financial Data Services, LLC		436998	N	609-274-6537	N	N	N	N	Other	Limited Liability Company	N	N	N	N	Y	Y	Y	Y	N	Y	Y	Y	N	Y	Y	N	Y	Y	N	Y	Y	Y	N	N
0001288777-20-000003	SEC	Computershare Trust Co of Canada		298181	N	4162639659	Y	N	Y	Y	Corporation		N	N	N	N	N	N	N	Y	N	Y	N	N	N	N	Y	N	N	Y	N	N	N	Y	N	N
0001288763-20-000016	SEC	Computershare Investor Services Inc		289645	N	4162639659	Y	N	Y	Y	Corporation		N	N	N	N	N	N	N	Y	N	Y	N	N	N	N	Y	N	N	Y	N	N	N	Y	N	N
0001667731-20-000279	SEC	Integral Transfer Agency USA, Inc.		346247	N	716-402-8539	Y	N	Y	N	Corporation		Y	N	Y	N	N	N	N	N	N	N	N	N	N	N	N	N	N	N	N	N	N	N	N	N
0001782266-20-000004	SEC	Securitize LLC		003641	N	4154138993	N	N	N	N	Other	Limited Liability Company	N	N	N	N	N	N	N	N	N	N	N	N	N	N	N	N	N	N	N	N	N	N	N	N
0001787835-20-000004	SEC	Financial Data Services, LLC		436998	N	609-274-6537	N	N	N	N	Other	Limited Liability Company	N	N	N	N	Y	Y	Y	Y	N	Y	Y	Y	N	Y	Y	N	Y	Y	N	Y	Y	Y	N	N
0001288777-20-000002	SEC	Computershare Trust Co of Canada		298181	N	4162639659	Y	N	Y	Y	Corporation		N	N	N	N	N	N	N	Y	N	Y	N	N	N	N	Y	N	N	Y	N	N	N	Y	N	N
0001288763-20-000015	SEC	Computershare Investor Services Inc		289645	N	4162639659	Y	N	Y	Y	Corporation		N	N	N	N	N	N	N	Y	N	Y	N	N	N	N	Y	N	N	Y	N	N	N	Y	N	N
0001288763-20-000014	SEC	Computershare Investor Services Inc		289645	N	4162639659	Y	N	Y	Y	Corporation		N	N	N	N	N	N	N	Y	N	Y	N	N	N	N	Y	N	N	Y	N	N	N	Y	N	N
0000794265-20-000006	SEC	AMERICAN CENTURY SERVICES LLC /TA	TWENTIETH CENTURY SERVICES INC                          /TA	378752	Y	816-531-5575	Y	N	Y	N	Other	Limited Liability Company	Y	N	N	N	N	N	N	N	N	N	N	Y	N	N	N	N	N	Y	N	Y	N	N	N	N
0001146230-20-000006	SEC	Computershare Inc /TA	Computershare Shareholder Services Inc /TA	260539	N	781-575-2000	Y	N	Y	Y	Corporation		N	N	N	N	N	N	N	Y	N	Y	N	N	N	N	Y	N	N	Y	N	N	N	Y	N	N
0001199835-20-000167	SEC	Sedona Equity Registrar & Transfer, Inc		353565	N	602-620-1554	N	N	Y	N	Corporation		N	Y	N	N	N	N	N	N	N	N	N	N	N	N	N	N	N	N	N	N	N	N	N	N
0001559963-20-000004	SEC	BNY Mellon International Operations (India) Private Ltd		347971	N	412-234-6365	Y	N	N	Y	Corporation		N	N	Y	N	Y	N	Y	Y	Y	Y	N	Y	N	Y	Y	N	Y	Y	N	N	Y	Y	N	N
0000849542-20-000003	SEC	BNY Mellon Investment Servicing (US) Inc.	PNC Global Investment Servicing (U.S.) Inc.	418772	N	508-871-8500	Y	N	Y	Y	Corporation		N	N	Y	N	Y	N	Y	Y	Y	Y	N	Y	N	Y	Y	N	Y	Y	N	N	Y	Y	N	N
0001817495-20-000001	SEC	2462344 Ontario Inc.		366732	Y	14163996477	N	N	N	N	Corporation		N	Y	N	N	N	N	N	N	N	N	N	N	N	N	N	N	N	N	N	N	N	N	N	N
0001452780-20-000003	SEC	DST Worldwide Services India Private Limited- TA	DST Global Solutions India Private Ltd - TA	339358	N	914066125521	Y	N	N	Y	Corporation		N	N	N	N	N	N	N	N	N	N	N	N	N	N	N	N	N	N	N	N	N	N	N	N
