ACCESSION_NUMBER	COMPANY_TYPE	SVCCOMPANY_ID	ENTITYNAME	FILENUMBER	ADDRESS
0001174540-10-000003	asServiceCompanyTransferAgent	50	Old Mutual Investment Partners	084-05735	    
0001174540-10-000003	asServiceCompanyTransferAgent	51	OppenheimerFunds, Inc.	084-01562	    
0001174540-10-000003	asServiceCompanyTransferAgent	52	PFPC, Inc	085-11196	    
0001174540-10-000003	asServiceCompanyTransferAgent	53	Phoenix Equity Funds (PEPCO)	084-05491	    
0001174540-10-000003	asServiceCompanyTransferAgent	54	Pioneer Funds Distributor, Inc.	084-01359	    
0001174540-10-000003	asServiceCompanyTransferAgent	55	Princor Financial Services Corporation (Principal Funds)	084-00253	    
0001174540-10-000003	asServiceCompanyTransferAgent	56	Prudential Mutual Fund Services LLC	084-05681	    
0001174540-10-000003	asServiceCompanyTransferAgent	57	Putnam Fiduciary Trust	085-00747	    
0001174540-10-000003	asServiceCompanyTransferAgent	58	Rydex Distributors, Inc.	084-05475	    
0001174540-10-000003	asServiceCompanyTransferAgent	59	Schwab (Charles Schwab & Co., Inc. - Charles Schwab Investment Management, Inc.)	084-05632	    
0001174540-10-000003	asServiceCompanyTransferAgent	60	SEI Investments Distribution Company	084-05652	    
0001174540-10-000003	asServiceCompanyTransferAgent	61	Seligman Financial Services	084-01895	    
0001174540-10-000003	asServiceCompanyTransferAgent	62	SSgA Funds	085-05003	    
0001174540-10-000003	asServiceCompanyTransferAgent	63	Strong Funds	084-01599	    
0001174540-10-000003	asServiceCompanyTransferAgent	64	UAM Fund Services	084-05613	    
0001174540-10-000003	asServiceCompanyTransferAgent	65	United States Trust Company	085-05001	    
0001174540-10-000003	asServiceCompanyTransferAgent	66	Van Kampen	084-01621	    
0001174540-10-000003	asServiceCompanyTransferAgent	67	Vanguard Group	084-00772	    
0001174540-10-000003	asServiceCompanyTransferAgent	68	Waddell & Reed, Inc.	084-01062	    
0001174540-10-000003	asServiceCompanyTransferAgent	69	Wasatch Funds	084-01222	    
0001174540-10-000003	asServiceCompanyTransferAgent	70	Wells Fargo	085-01033	    
0000869442-10-000004	serviceCompany	1	Boston Financial Data Services, Inc.	084-00896	2 Heritage Drive  North Quincy  02171
0001018490-10-000003	asServiceCompany	1	Deutsche Bank Trust Company Americas	085-05212	60 Wall Street, Mail Stop NYC60-3012  New York  10005-2836
0000869442-10-000003	serviceCompany	1	Boston Financial Data Services, Inc.	084-00896	2 Heritage Drive  North Quincy  02171
0000838596-10-000002	serviceCompanyTransferAgent	1	US Bank, National Association	085-11347	    
0001352156-10-000003	asServiceCompany	1	Reich & Tang Services, Inc.	084-02007	600 Fifth Avenue  New York  10020
0001352156-10-000003	serviceCompany	1	DST Systems, Inc.	084-00448	1055 Broadway  Kansas City  64105
0001352156-10-000003	serviceCompany	2	Boston Financial Data Services	084-00896	2 Heritage Drive  North Quincy  02171
0000772037-10-000001	serviceCompany	1	Boston Financial Data Services, Inc.	084-00896	Two Heritage Drive  North Quincy  02190
0000948010-10-000002	serviceCompany	1	VISTA FIDUCIARY SERVICES INC	084-06058	1200 WALL STREET WEST 3RD FL  LYNDHURST  07071
0001418054-10-000004	serviceCompanyTransferAgent	1	State Street Bank and Trust Company	085-05003	    
0000950123-10-003644	asServiceCompany	1	Invesco Aim Investment Services, Inc.	084-05432	11 Greenway Plaza Ste 100 Houston  77046
0001418054-10-000003	serviceCompany	1	State Street Bank and Trust Company	085-05003	One Lincoln Street  Boston  02111
0000948010-10-000001	serviceCompany	1	VISTA FIDUCIARY SERVICES INC	084-06058	1200 WALL STREET WEST 3RD FL  LYNDHURST  07071
0001430805-10-000002	serviceCompanyTransferAgent	1	Zions First National Bank	085-01987	    
0000839196-10-000005	asServiceCompanyTransferAgent	1	Amegy Bank National Association	085-11411	    
0001144204-10-000666	serviceCompanyTransferAgent	1	Olde Monmouth Stock Transfer Co.	084-01968	    
0001179131-10-000004	serviceCompanyTransferAgent	1	The Bank of New York Mellon	085-05006	    
0000810704-10-000002	asServiceCompany	1	PNC Global Investment Services, Inc. fka PFPC Global Fund Services, Inc.	084-01761	400 Bellevue Parkway  Wilmington  19809
0000810704-10-000002	asServiceCompany	2	Van Kampen Investor Service	084-01621	Harborside Financial Center Plaza Two  Jersey City  07311-3977
0000810704-10-000002	asServiceCompany	3	Aim Fund Services, Inc.	084-05432	11 Greenway Plaza Suite 100 Houston  77046
0000810704-10-000002	asServiceCompany	4	Pioneer Investment Management Shareholder Services	084-01359	60 State Street  Boston  02109
