ACCESSION_NUMBER	REGULATORYAGENCY	ENTITYNAME	PREVIOUSENTITYNAME	FINSNUMBER	DIFFERENTMAILINGADDRESS	TELEPHONENUMBER	CONDUCTBUSINESSINOTHERLOCATION	SELFTRANSFERAGENT	ENGAGEDSERVICECOMPANY	ENGAGEDASSERVICECOMPANY	REGISTRANTTYPE	REGISTRANTTYPEDESCRIPTION	OTHERCONTROLMANAGEMENT	OTHERCONTROLFINANCE	FELONYORMISDEMEANOR	OTHERFELONY	ENJOINEDINVESTRELATEDACTIVITY	VIOLATIONINVRELATEDREGULATION	FALSESTATEMENTOROMISSION	VIOLATIONOFREGULATIONS	AUTHORIZATIONDENIEDORSUSPENDED	REGISTRATIONDENIEDORSUSPENDED	FSRFALSESTATEMENTOROMISSION	FSRVIOLATEINVRELATEDREGULATION	FSRAUTHORIZEDENIEDORSUSPENDED	FSRFOUNDORDERAGAINSTAPPLICANT	FSRREGISTRATIONDENIEDSUSPENDED	FSRREVOKEDSUSPENDEDLICENSE	SRAFALSESTATEMENTOROMISSION	SRAVIOLATIONOFRULES	SRAAUTHORIZEDENIEDORSUSPENDED	SRAREVOKEDSUSPENDEDLICENSE	FOREIGNAGENCY	SUBJECTOFPROCEEDINGS	REVOKEDBOND	UNSATISFIEDJUDGEMENTSORLIENS
0001452780-23-000007	SEC	SS&C FinTech Services India Private Ltd	DST Worldwide Services India Private Limited- TA	339358	N	914066125521	Y	N	N	Y	Corporation		N	N	N	N	N	N	N	Y	N	N	N	N	N	N	N	N	N	N	N	N	N	N	N	N
0000027048-23-000009	SEC	SS&C GIDS, Inc.	DST SYSTEMS INC /TA	401588	Y	816-435-1000	Y	N	Y	Y	Corporation		N	N	N	N	N	N	N	Y	N	N	N	N	N	N	N	N	N	N	N	N	N	N	N	N
0000275143-23-000007	SEC	DST ASSET MANAGER SOLUTIONS, INC./TA	BOSTON FINANCIAL DATA SERVICES, INC. /TA	401588	N	617-483-5000	Y	N	Y	N	Corporation		N	N	N	N	N	N	N	Y	N	N	N	N	N	N	N	N	N	N	N	N	N	N	N	N
0001817495-23-000006	SEC	2462344 Ontario Inc.		366732	N	4168304334	N	N	N	N	Corporation		N	Y	N	N	N	N	N	N	N	N	N	N	N	N	N	N	N	N	N	N	N	N	N	N
0001073944-23-000008	SEC	UMB FUND SERVICES INC		852947	N	414-299-2000	Y	N	N	Y	Corporation		N	N	N	N	N	N	N	Y	N	N	N	N	N	N	N	N	N	N	N	N	N	N	N	N
0001846058-23-000003	SEC	BlockTrans Syndicate		368282	N	(209) BT-HELPS	N	N	N	N	Corporation		N	N	N	N	N	N	N	N	N	N	N	N	N	N	N	N	N	N	N	N	N	N	N	N
0000734924-23-000002	SEC	KANSAS CITY LIFE INSURANCE CO TA /TA	KANSAS CITY LIFE INSURANCE CO TA                        /TA	403527	N	816-753-7000	N	Y	N	N	Not Applicable																									
0001018490-23-000030	SEC	DB SERVICES AMERICAS INC /TA	DB SERVICES TENNESSEE INC /TA	955203	N	(800) 735-7777	N	N	N	Y	Corporation		Y	Y	Y	Y	Y	Y	Y	Y	N	Y	Y	Y	N	Y	N	N	Y	Y	N	N	Y	Y	N	N
0000842657-23-000023	SEC	DWS Service Co	Deutsche AM Service Co	417949	N	212-250-2500	N	Y	Y	N	Corporation		N	N	Y	Y	Y	Y	Y	Y	N	Y	Y	Y	N	Y	N	N	Y	Y	N	N	Y	Y	N	N
0000734700-23-000008	SEC	GOLDMAN SACHS & CO. LLC /TA	GOLDMAN SACHS & CO /TA	900050	N	312-655-4400	N	N	Y	N	Corporation		N	N	Y	Y	Y	Y	Y	Y	N	Y	Y	Y	N	Y	Y	N	N	Y	N	N	Y	Y	N	N
0001654954-23-012082	SEC	MANHATTAN TRANSFER REGISTRAR CO /TA	MANHATTAN TRANSFER REGISTRAR CO /NY/                    /TA	432708	N	631-928-7655	N	N	N	Y	Corporation		N	N	N	N	N	N	N	N	N	N	N	N	N	N	N	N	N	N	N	N	N	N	N	N
0000733598-23-000005	SEC	ALLIANCEBERNSTEIN INVESTOR SERVICES INC /TA	ALLIANCE FUND SERVICES INC                              /TA	407254	N	210-384-6000	Y	N	N	N	Corporation		Y	N	N	N	N	N	N	N	N	N	N	N	N	N	N	N	N	N	N	N	N	N	N	N
0001227021-23-000007	SEC	BROWN BROTHERS HARRIMAN & CO		269159	N	617.772.1818	Y	N	N	N	Partnership		N	N	N	N	N	N	N	Y	N	N	N	N	N	N	N	N	N	Y	N	N	N	N	N	N
0001458682-23-000004	SEC	ClearTrust, LLC		340034	N	813-235-4490	N	N	N	Y	Other	Limited Liability Company	N	Y	N	N	N	N	N	N	N	N	N	N	N	N	N	N	N	N	N	N	N	N	N	N
0001387131-23-010572	SEC	Equiniti Trust Company, LLC /TA	AMERICAN STOCK TRANSFER & TRUST CO, LLC /TA	404194	N	718-921-8295	Y	N	Y	Y	Other	Limited Liability Trust Co.	N	N	N	N	N	N	N	N	N	N	N	N	N	N	N	N	N	N	N	N	N	N	N	N
0000842657-23-000022	SEC	DWS Service Co	Deutsche AM Service Co	417949	N	212-250-2500	N	Y	Y	N	Corporation		N	N	Y	Y	Y	Y	Y	Y	N	Y	Y	Y	N	Y	N	N	Y	Y	N	N	Y	Y	N	N
0001018490-23-000027	SEC	DB SERVICES AMERICAS INC /TA	DB SERVICES TENNESSEE INC /TA	955203	N	(800) 735-7777	N	N	N	Y	Corporation		Y	Y	Y	Y	Y	Y	Y	Y	N	Y	Y	Y	N	Y	N	N	Y	Y	N	N	Y	Y	N	N
0001718015-23-000009	SEC	Odyssey Trust Co		354050	N	587-885-0960	Y	N	Y	Y	Corporation		N	N	N	N	N	N	N	N	N	N	N	N	N	N	N	N	N	N	N	N	N	N	N	N
0000734700-23-000007	SEC	GOLDMAN SACHS & CO. LLC /TA	GOLDMAN SACHS & CO /TA	900050	N	312-655-4400	N	N	Y	N	Corporation		N	N	Y	Y	Y	Y	Y	Y	N	Y	Y	Y	N	Y	Y	N	N	Y	N	N	Y	Y	N	N
0000735286-23-000017	SEC	VANGUARD GROUP INC		385385	N	610-669-1000	Y	Y	Y	N	Corporation		N	N	N	N	N	N	N	N	N	N	N	Y	N	N	N	N	N	Y	N	N	Y	N	N	N
0001137439-23-000988	SEC	Delaware Investments Fund Services Co		350447	N	(800) 523-1918	N	Y	Y	N	Corporation		N	N	N	N	Y	N	Y	Y	N	N	N	N	N	N	N	N	N	N	N	N	Y	N	N	N
0001202048-23-000004	SEC	VALIC RETIREMENT SERVICES CO	AIG RETIREMENT SERVICES CO	502575	N	713-831-3150	N	N	N	N	Corporation		Y	N	N	N	N	N	Y	Y	N	N	Y	Y	N	Y	N	N	N	Y	N	N	N	N	N	N
0001920289-23-000003	SEC	Fidelity Stock Transfer Solutions LLC		370197	Y	4012926071	Y	N	N	N	Other	LLC	Y	N	N	N	Y	N	N	N	N	N	N	N	N	N	N	N	N	Y	N	N	Y	Y	N	N
0001133702-23-000003	SEC	Fidelity Business Services India Private Ltd	Fidelity Business Services India Private LTD	334318	Y	401-292-6071	Y	N	N	Y	Corporation		Y	Y	N	N	Y	N	Y	Y	N	N	N	Y	N	N	N	N	N	Y	N	N	Y	N	N	N
0001133702-23-000002	SEC	NATIONAL FINANCIAL SERVICES LLC /TA		061671	Y	401-292-6071	Y	N	N	Y	Corporation		N	N	N	N	Y	N	Y	Y	N	N	N	Y	N	N	N	N	N	Y	N	N	Y	N	N	N
0000862124-23-000003	SEC	FIDELITY INVESTMENTS INSTITUTIONAL OPERATIONS CO LLC	FIDELITY INVESTMENTS WESTERN SERVICES CO INC            /TA	428219	Y	401-292-6071	Y	N	Y	N	Corporation		N	N	N	N	Y	N	Y	Y	N	N	N	Y	N	N	N	N	N	Y	N	N	Y	N	N	N
0000735383-23-000003	SEC	HARTFORD ADMINISTRATIVE SERVICES CO /TA	FORTIS ADVISERS INC /MN/                                /TA	401778	N	610.386.7688	Y	Y	Y	N	Not Applicable				N	N	N	N	N	N	N	N	N	N	N	N	N	N	N	N	N	N	N	N	N	N
0000735286-23-000015	SEC	VANGUARD GROUP INC		385385	N	610-669-1000	Y	Y	Y	N	Corporation		N	N	N	N	N	N	N	N	N	N	N	Y	N	N	N	N	N	Y	N	N	Y	N	N	N
0000810704-23-000005	SEC	PRIMERICA SHAREHOLDER SERVICES, INC.	PRIMERICA SHAREHOLDER SERVICES /TA	409573	N	470-564-5256	N	N	N	Y	Corporation		N	N	N	N	N	N	N	N	N	N	N	N	N	N	N	N	N	N	N	N	N	N	N	N
0000734700-23-000006	SEC	GOLDMAN SACHS & CO. LLC /TA	GOLDMAN SACHS & CO /TA	900050	N	312-655-4400	N	N	Y	N	Corporation		N	N	Y	Y	Y	Y	Y	Y	N	Y	Y	Y	N	Y	Y	N	N	Y	N	N	Y	Y	N	N
0000733598-23-000004	SEC	ALLIANCEBERNSTEIN INVESTOR SERVICES INC /TA	ALLIANCE FUND SERVICES INC                              /TA	407254	N	210-384-6000	Y	N	N	N	Corporation		Y	N	N	N	N	N	N	N	N	N	N	N	N	N	N	N	N	N	N	N	N	N	N	N
0000842657-23-000020	SEC	DWS Service Co	Deutsche AM Service Co	417949	N	212-250-2500	N	Y	Y	N	Corporation		N	N	Y	Y	Y	Y	Y	Y	N	Y	Y	Y	N	Y	N	N	Y	Y	N	N	Y	Y	N	N
0001018490-23-000025	SEC	DB SERVICES AMERICAS INC /TA	DB SERVICES TENNESSEE INC /TA	955203	N	(800) 735-7777	N	N	N	Y	Corporation		Y	Y	Y	Y	Y	Y	Y	Y	N	Y	Y	Y	N	Y	N	N	Y	Y	N	N	Y	Y	N	N
0001146230-23-000009	SEC	Computershare Inc /TA	Computershare Shareholder Services Inc /TA	260539	N	781-575-2000	Y	N	Y	Y	Corporation		N	N	N	N	N	N	N	Y	N	Y	N	N	N	N	Y	N	N	Y	N	N	N	Y	N	N
0000950123-23-006457	SEC	TRANSAMERICA FUND SERVICES, INC	BMW Financial Services NA, LLC	410654	N	720-482-1500	N	N	Y	N	Corporation		N	N	N	N	N	N	Y	Y	Y	Y	Y	Y	N	Y	Y	N	N	Y	N	N	Y	N	Y	N
0001665086-23-000001	SEC	Sutter Shareholder Services, LLC	FlashFunders Shareholder Services, LLC	352757	N	3105043706	N	N	N	N	Corporation		N	N	N	N	N	N	N	N	N	N	N	N	N	N	N	N	N	N	N	N	N	N	N	N
0001559963-23-000004	SEC	BNY Mellon International Operations (India) Private Ltd		347971	N	412-234-6365	Y	N	N	Y	Corporation		N	N	Y	N	Y	N	Y	Y	Y	Y	N	Y	N	Y	Y	N	Y	Y	N	N	Y	Y	N	N
0001288763-23-000006	SEC	Computershare Trust Co of Canada		298181	N	4162639659	Y	N	Y	Y	Corporation		N	N	N	N	N	N	N	Y	N	Y	N	N	N	N	Y	N	N	Y	N	N	N	Y	N	N
0001288763-23-000005	SEC	Computershare Investor Services Inc		289645	N	4162639659	Y	N	Y	Y	Corporation		N	N	N	N	N	N	N	Y	N	Y	N	N	N	N	Y	N	N	Y	N	N	N	Y	N	N
0000734713-23-000009	SEC	GRAYBAR ELECTRIC CO INC TA /TA	GRAYBAR ELECTRIC CO INC TA                              /TA	407783	N	(314) 573-9200	N	Y	Y	N	Not Applicable		N	N	N	N	N	N	N	N	N	N	N	N	N	N	N	N	N	N	N	N	N	N	N	N
0001139578-23-000006	SEC	HARBOR SERVICES GROUP INC /TA	BLADE TRANSFER INC                                      /TA	082644	Y	312-443-4400	N	N	N	N	Corporation		Y	N	N	N	N	N	N	N	N	N	N	N	N	N	N	N	N	Y	N	N	Y	N	N	N
0001985383-23-000001	SEC	Landa Transfer Agent LLC		373167	N	6469050931	N	Y	N	N	Other	Limited Liability Company	Y	Y	N	N	N	N	N	N	N	N	N	N	N	N	N	N	N	N	N	N	N	N	N	N
0000005076-23-000005	SEC	AMERICAN FUNDS SERVICE Co	AMERICAN FUNDS SERVICE CO /TA	403444	Y	949-975-5000	Y	N	Y	N	Corporation		N	N	N	Y	N	N	N	N	N	N	N	N	N	N	N	N	N	N	N	N	N	N	N	N
0000842657-23-000018	SEC	DWS Service Co	Deutsche AM Service Co	417949	N	212-250-2500	N	Y	Y	N	Corporation		N	N	Y	Y	Y	Y	Y	Y	N	Y	Y	Y	N	Y	N	N	Y	Y	N	N	Y	Y	N	N
0001018490-23-000023	SEC	DB SERVICES AMERICAS INC /TA	DB SERVICES TENNESSEE INC /TA	955203	N	(800) 735-7777	N	N	N	Y	Corporation		Y	Y	Y	Y	Y	Y	Y	Y	N	Y	Y	Y	N	Y	N	N	Y	Y	N	N	Y	Y	N	N
0001559963-23-000003	SEC	BNY Mellon International Operations (India) Private Ltd		347971	N	412-234-6365	Y	N	N	Y	Corporation		N	N	Y	N	Y	N	Y	Y	Y	Y	N	Y	N	Y	Y	N	Y	Y	N	N	Y	Y	N	N
0001562770-23-000006	SEC	Virtus Fund Services, LLC		030197	Y	800-248-7971	N	N	Y	N	Other	Limited Liability Corporation	Y	Y	N	N	N	N	Y	Y	N	Y	N	N	N	N	N	N	N	Y	N	N	Y	N	Y	N
0000733598-23-000003	SEC	ALLIANCEBERNSTEIN INVESTOR SERVICES INC /TA	ALLIANCE FUND SERVICES INC                              /TA	407254	N	210-384-6000	Y	N	N	N	Corporation		Y	N	N	N	N	N	N	N	N	N	N	N	N	N	N	N	N	N	N	N	N	N	N	N
0000849542-23-000004	SEC	BNY Mellon Investment Servicing (US) Inc.	PNC Global Investment Servicing (U.S.) Inc.	418772	N	508-871-9006	Y	N	Y	Y	Corporation		N	N	Y	N	N	N	Y	Y	Y	Y	N	Y	N	Y	Y	N	Y	Y	N	N	Y	Y	N	N
