ACCESSION_NUMBER	COMPANY_TYPE	SVCCOMPANY_ID	ENTITYNAME	FILENUMBER	ADDRESS
0001455353-15-000002	serviceCompanyTransferAgent	1	Direct Transfer LLC	084-06338	    
0000950123-15-004188	serviceCompanyTransferAgent	1	BFDS, Inc.	084-00896	    
0000950123-15-004188	serviceCompanyTransferAgent	2	DST, Inc.	084-00448	    
0001146230-15-000016	asServiceCompanyTransferAgent	1	Citibank, N.A.	085-10232	    
0001146230-15-000016	asServiceCompanyTransferAgent	2	Computershare Trust Company of Canada	084-06112	    
0001146230-15-000016	asServiceCompanyTransferAgent	3	Computershare Investor Services Inc.	084-06111	    
0001146230-15-000016	asServiceCompanyTransferAgent	4	State Street Bank and Trust Company	085-05003	    
0001146230-15-000016	asServiceCompanyTransferAgent	5	Computershare Trust Company, N.A.	085-11340	    
0001146230-15-000016	asServiceCompanyTransferAgent	6	The Bank of New York Mellon	085-05006	    
0001146230-15-000016	asServiceCompanyTransferAgent	7	BNY Mellon Investment Servicing (US) Inc.	084-01761	    
0001146230-15-000016	asServiceCompanyTransferAgent	8	Citi Fund Services Ohio, Inc.	085-11408	    
0001146230-15-000016	serviceCompanyTransferAgent	1	The Colbent Corporation	084-05927	    
0001146230-15-000016	serviceCompanyTransferAgent	2	Computershare Trust Company of Canada	084-06112	    
0001073944-15-000003	asServiceCompanyTransferAgent	1	JD Clark & Co, Inc.	084-06025	    
0001073944-15-000003	asServiceCompanyTransferAgent	2	SEI	084-01318	    
0001073944-15-000003	serviceCompanyTransferAgent	1	JD Clark & Co, Inc.	084-06025	    
0000733598-15-000002	asServiceCompanyTransferAgent	1	U.S. Bancorp Fund Services, LLC	085-11357	    
0001144204-15-020061	serviceCompanyTransferAgent	1	WORLDWIDE STOCK TRANSFER LLC	084-06153	    
0001022437-15-000002	serviceCompanyTransferAgent	1	Deutsche Bank Trust Company Americas	085-05212	    
0001022437-15-000002	serviceCompanyTransferAgent	2	Computershare Inc	084-05925	    
0001139576-15-000001	serviceCompanyTransferAgent	1	DST Systems, Inc.	084-00448	    
0001145892-15-000002	asServiceCompanyTransferAgent	1	Citibank, N.A.	085-10232	    
0001145892-15-000002	asServiceCompanyTransferAgent	2	Computershare Trust Company of Canada	084-06112	    
0001145892-15-000002	asServiceCompanyTransferAgent	3	Computershare Investor Services Inc.	084-06111	    
0001145892-15-000002	asServiceCompanyTransferAgent	4	Citi Fund Services Ohio, Inc.	085-11408	    
0001145892-15-000002	serviceCompanyTransferAgent	1	Computershare Inc.	084-05925	    
0001146230-15-000014	asServiceCompanyTransferAgent	1	Registrar and Transfer Corporation - New York	084-00528	    
0000721748-15-000175	serviceCompanyTransferAgent	1	Continental Stock Transfer	084-00034	    
0001146230-15-000013	serviceCompanyTransferAgent	1	Registrar and Transfer Company (New Jersey)	084-00436	    
0000740583-15-000162	asServiceCompanyTransferAgent	1	Rydex Fund Services, LLC	084-05475	    
0001077455-15-000001	asServiceCompanyTransferAgent	1	American Funds	084-05504	    
0001144204-15-019805	asServiceCompanyTransferAgent	1	Guardian Registrar & Transfer, Inc.	084-06184	    
0001144204-15-019805	serviceCompanyTransferAgent	1	FIRST AMERICAN STOCK TRANSFER INC /AZ/ /TA	084-05795	    
0001430805-15-000002	serviceCompanyTransferAgent	1	Zions First National Bank	085-10987	    
0001430805-15-000001	asServiceCompanyTransferAgent	1	Amegy Bank National Association	085-11411	    
0000838141-15-000003	asServiceCompanyTransferAgent	1	Whitney Bank, formerly Hancock Bank of Louisiana	085-00741	    
0000838141-15-000003	serviceCompanyTransferAgent	1	Huntington National Bank/OH/TA	085-10275	    
0001077223-15-000003	serviceCompanyTransferAgent	1	JP MORGAN	085-11399	    
0001354488-15-001450	asServiceCompanyTransferAgent	1	West Coast Stock Transfer Inc.	084-06347	    
0001354488-15-001450	asServiceCompanyTransferAgent	2	Web Stock Transfer Agency Inc.	084-06451	    
0001354488-15-001450	asServiceCompanyTransferAgent	3	Mountain Share Transfer, LLC	084-05790	    
0001354488-15-001450	asServiceCompanyTransferAgent	4	GLOBEX TRANSFER, LLC	084-06307	    
0001354488-15-001446	serviceCompanyTransferAgent	1	Direct Transfer, LLC.	084-06338	    
0000950123-15-004174	asServiceCompanyTransferAgent	1	SHAREHOLDER SERVICES INC	084-00907	    
0001410578-15-000127	asServiceCompanyTransferAgent	1	Alliance Bernstein Global Investor Services, Inc.	084-01187	    
0001410578-15-000127	asServiceCompanyTransferAgent	2	American Century Services Corporation	084-01406	    
0001410578-15-000127	asServiceCompanyTransferAgent	3	American Funds Service Company	084-00316	    
0001410578-15-000127	asServiceCompanyTransferAgent	4	Boston Financial Data Services, Inc.	084-00896	    
0001410578-15-000127	asServiceCompanyTransferAgent	5	DST Systems, Inc.	084-00448	    
0001410578-15-000127	asServiceCompanyTransferAgent	6	Fidelity Investments Institutional Operations Company, Inc	084-01839	    
0001410578-15-000127	asServiceCompanyTransferAgent	7	US Bancorp Fund Services, LLC	085-11357	    
0001410578-15-000127	asServiceCompanyTransferAgent	8	Franklin Templeton Investor Services LLC	084-01036	    
0001410578-15-000127	asServiceCompanyTransferAgent	9	Harbor Services Group Inc.	084-05901	    
0001410578-15-000127	asServiceCompanyTransferAgent	10	MFS Service Center, Inc.	084-01316	    
0001410578-15-000127	asServiceCompanyTransferAgent	11	OppenheimerFunds, Inc.	084-01562	    
0001410578-15-000127	asServiceCompanyTransferAgent	12	BNY Mellon Investment Servicing	084-01761	    
0001410578-15-000127	asServiceCompanyTransferAgent	13	Putnam Investor Services Inc.	084-06331	    
0001410578-15-000127	asServiceCompanyTransferAgent	14	State Street Bank & Trust Company	085-05003	    
0001410578-15-000127	asServiceCompanyTransferAgent	15	T. Rowe Price Services, Inc.	084-01079	    
0001410578-15-000127	asServiceCompanyTransferAgent	16	Hartford Administrative Services Company	084-00353	    
0001410578-15-000127	asServiceCompanyTransferAgent	17	UMB Fund Services Inc.	084-05792	    
0001410578-15-000127	asServiceCompanyTransferAgent	18	JPMorgan Chase Bank NA	085-11399	    
0001410578-15-000127	asServiceCompanyTransferAgent	19	Pioneer Investment Management Shareholder Services, Inc.	084-01359	    
0001410578-15-000127	asServiceCompanyTransferAgent	20	Bank of New York/Mellon	085-05006	    
0001410578-15-000127	asServiceCompanyTransferAgent	21	Prudential Mutual Fund Services LLC	084-05681	    
0001410578-15-000127	asServiceCompanyTransferAgent	22	Citi Fund Services of Ohio	085-11408	    
0001410578-15-000127	asServiceCompanyTransferAgent	23	Waddell & Reed Services Company	084-01062	    
0001410578-15-000127	asServiceCompanyTransferAgent	24	Northern Trust Co.	085-05127	    
0001410578-15-000127	asServiceCompanyTransferAgent	25	SEI Institutional Transfer Agent, Inc.	084-06349	    
0001410578-15-000127	asServiceCompanyTransferAgent	26	Columbia Management Investor Services Corp	084-05685	    
0001410578-15-000127	asServiceCompanyTransferAgent	27	Bank of New York Mellon Trust Co. NA	085-11396	    
0001410578-15-000127	asServiceCompanyTransferAgent	28	Invesco Investment Services Inc.	084-05432	    
0001410578-15-000127	asServiceCompanyTransferAgent	29	Vanguard Group Inc.	084-00772	    
0001410578-15-000127	asServiceCompanyTransferAgent	30	Russel Fund Services Co.	084-06276	    
0001410578-15-000127	asServiceCompanyTransferAgent	31	State Farm Investment Management Corp	084-00839	    
0001410578-15-000127	asServiceCompanyTransferAgent	32	American Stock Transfer and Trust Company	084-00416	    
0001410578-15-000127	asServiceCompanyTransferAgent	33	Parnassus Investments	084-01519	    
0000839287-15-000003	asServiceCompanyTransferAgent	1	Goldman Sachs & Co.	084-01100	    
0000839287-15-000003	asServiceCompanyTransferAgent	2	Russell Fund Services Company	084-06276	    
0000839287-15-000003	serviceCompanyTransferAgent	1	Boston Financial Data Services, Inc.	084-00896	    
0000839287-15-000003	serviceCompanyTransferAgent	2	DST Systems, Inc.	084-00448	    
0000839287-15-000003	serviceCompanyTransferAgent	3	National Financial Data Services, Inc.	084-01078	    
0000839287-15-000003	serviceCompanyTransferAgent	4	Computershare Inc.	084-05925	    
0001354488-15-001414	serviceCompanyTransferAgent	1	Direct Transfer, LLC.	084-06338	    
0001288763-15-000002	asServiceCompanyTransferAgent	1	Computershare Trust Company of Canada	084-06112	    
0001288763-15-000002	asServiceCompanyTransferAgent	2	Computershare Trust Company, NA	085-11340	    
0001288763-15-000002	asServiceCompanyTransferAgent	3	Computershare Inc.	084-05925	    
0001288763-15-000002	serviceCompanyTransferAgent	1	Computershare Trust Company of Canada	084-06112	    
0001288763-15-000002	serviceCompanyTransferAgent	2	Computershare Trust Company, NA	085-11340	    
0001288763-15-000002	serviceCompanyTransferAgent	3	Computershare Inc.	084-05925	    
0001288777-15-000002	asServiceCompanyTransferAgent	1	Computershare Investor Services Inc.	084-06111	    
0001288777-15-000002	asServiceCompanyTransferAgent	2	Computershare Trust Company, NA	085-11340	    
0001288777-15-000002	asServiceCompanyTransferAgent	3	Computershare Inc.	084-05925	    
0001288777-15-000002	serviceCompanyTransferAgent	1	Computershare Investor Services Inc.	084-06111	    
0001288777-15-000002	serviceCompanyTransferAgent	2	Computershare Trust Company, NA	085-11340	    
0001288777-15-000002	serviceCompanyTransferAgent	3	Computershare Inc.	084-05925	    
0000788603-15-000006	asServiceCompanyTransferAgent	1	State Street Bank and Trust Company	085-05003	    
0000788603-15-000006	asServiceCompanyTransferAgent	2	DST Systems, Inc.	084-00448	    
0000788603-15-000006	asServiceCompanyTransferAgent	3	Boston Financial Data Services, Inc.	084-00896	    
0000788603-15-000006	asServiceCompanyTransferAgent	4	Goldman Sachs & Co.	084-00110	    
0000788603-15-000006	asServiceCompanyTransferAgent	5	Wallace R. Weitz & Company	084-01858	    
0000788603-15-000006	serviceCompanyTransferAgent	1	DST Systems, Inc.	084-00448	    
0000788603-15-000006	serviceCompanyTransferAgent	2	Boston Financial Data Services, Inc.	084-00896	    
0000275143-15-000007	asServiceCompanyTransferAgent	1	State Street Bank and Trust Company	085-05003	    
0000275143-15-000007	asServiceCompanyTransferAgent	2	DST Systems, Inc.	084-00448	    
0000275143-15-000007	asServiceCompanyTransferAgent	3	NYLIM Service Company LLC.	084-05844	    
0000275143-15-000007	asServiceCompanyTransferAgent	4	Columbia Management Investment Services Corporation	084-05685	    
0000275143-15-000007	asServiceCompanyTransferAgent	5	Sentinel Administrative Services	084-06175	    
0000275143-15-000007	asServiceCompanyTransferAgent	6	Pioneer Investment Management Shareholder Services, Inc.	084-01359	    
0000275143-15-000007	asServiceCompanyTransferAgent	7	Principal Shareholder Services	084-05657	    
0000275143-15-000007	asServiceCompanyTransferAgent	8	MFS Services Center, Inc.	084-01316	    
0000275143-15-000007	asServiceCompanyTransferAgent	9	Transamerica Fund Services, Inc.	084-06130	    
0000275143-15-000007	asServiceCompanyTransferAgent	10	John Hancock Signature Services, Inc.	084-01885	    
0000275143-15-000007	asServiceCompanyTransferAgent	11	Hartford Administrative Services Company	084-00353	    
0000275143-15-000007	asServiceCompanyTransferAgent	12	Citibank, N.A.	085-10232	    
0000275143-15-000007	serviceCompanyTransferAgent	1	DST Systems, Inc.	084-00448	    
0000275143-15-000007	serviceCompanyTransferAgent	2	National Financial Data Services, Inc.	084-01078	    
0001434234-15-000001	serviceCompanyTransferAgent	1	DIRECT TRANSFER, LLC	084-06338	    
0001133796-15-000028	asServiceCompanyTransferAgent	1	CST Trust Company	084-06506	    
0001133796-15-000028	serviceCompanyTransferAgent	1	American Stock Transfer & Trust Company, LLC	084-00416	    
0001133796-15-000028	serviceCompanyTransferAgent	2	Computershare Investor Services Inc.	084-06111	    
0001133796-15-000026	asServiceCompanyTransferAgent	1	American Stock Transfer & Trust Company, LLC	084-00416	    
0001133796-15-000026	serviceCompanyTransferAgent	1	American Stock Transfer & Trust Company, LLC	084-00416	    
0001133796-15-000026	serviceCompanyTransferAgent	2	Computershare Investor Services Inc.	084-06111	    
0001133796-15-000026	serviceCompanyTransferAgent	3	CST Investor Services Inc.	084-06416	    
0001218371-15-000002	serviceCompanyTransferAgent	1	American Stock Transfer Company & Trust, LLC	084-00416	    
0001073944-15-000002	asServiceCompanyTransferAgent	1	JD Clark & Co, Inc.	084-06025	    
0001073944-15-000002	asServiceCompanyTransferAgent	2	SEI	084-01318	    
0001073944-15-000002	serviceCompanyTransferAgent	1	JD Clark & Co, Inc.	084-06025	    
0001103598-15-000003	serviceCompanyTransferAgent	1	Boston Financial Data Services Inc.	084-00896	    
0001096906-15-000308	serviceCompanyTransferAgent	1	Interwest Transfer., Inc.	084-00273	    
0001283467-15-000003	asServiceCompanyTransferAgent	1	Securities Transfer Corporation	084-01567	    
0001283467-15-000003	serviceCompanyTransferAgent	1	Registrar and Transfer Company	084-00436	    
0001283467-15-000003	serviceCompanyTransferAgent	2	First American Stock Transfer Company	084-05795	    
0001096906-15-000305	asServiceCompanyTransferAgent	1	Progressive Transfer Corp.	084-01335	    
0001146032-15-000004	serviceCompanyTransferAgent	1	BNY MELLON INVESTMENT SERVICING (US) INC	084-01761	    
0000817712-15-000009	serviceCompany	1	DST Systems, Inc.	084-00448	301 W. 11th Street  Kansas City  64105
0001020337-15-000002	serviceCompanyTransferAgent	1	Boston Financial Data Services, Inc.	084-00896	    
0000889231-15-000010	serviceCompanyTransferAgent	1	Sentinel Administrative Services, Inc.	084-06175	    
0000889231-15-000009	serviceCompany	1	Sentinel Administrative Services, Inc.	084-06175	One National Life Drive  Montpelier  05604
0000891804-15-000202	serviceCompanyTransferAgent	1	Boston Financial Data Services	084-01078	    
0001506388-15-000002	asServiceCompanyTransferAgent	1	Aflac Incorporated	084-00501	    
0000734700-15-000001	serviceCompanyTransferAgent	1	Boston Financial Data Services Inc.	084-00896	    
0000734700-15-000001	serviceCompanyTransferAgent	2	DST Systems Inc.	084-00448	    
0000734700-15-000001	serviceCompanyTransferAgent	3	State Street Bank & Trust	085-05003	    
0000734700-15-000001	serviceCompanyTransferAgent	4	National Financial Data Services Inc.	084-01078	    
0001451316-15-000004	asServiceCompanyTransferAgent	1	Franklin Templeton Investor Services, LLC	084-01036	    
0000353291-15-000002	serviceCompanyTransferAgent	1	Franklin Templeton International Services (India) Private Limited	084-06303	    
0000353291-15-000002	serviceCompanyTransferAgent	2	Franklin Templeton Investments Poland sp. z o.o	084-06302	    
0000353291-15-000002	serviceCompanyTransferAgent	3	Franklin Templeton Investment Services, GmbH	084-06340	    
0001432531-15-000004	asServiceCompanyTransferAgent	1	Franklin Templeton Investor Services, LLC	084-01036	    
0001432532-15-000002	asServiceCompanyTransferAgent	1	Franklin Templeton Investor Services, LLC	084-01036	    
0000769188-15-000004	serviceCompanyTransferAgent	1	Boston Financial Data Services	084-00896	    
0000027048-15-000003	asServiceCompanyTransferAgent	1	Thrivent Financial Investor Services, Inc.	084-01547	    
0000027048-15-000003	asServiceCompanyTransferAgent	2	State Street Bank & Trust	085-05003	    
0000027048-15-000003	asServiceCompanyTransferAgent	3	DeAWM Service Company	084-01713	    
0000027048-15-000003	asServiceCompanyTransferAgent	4	State Farm Investment Management Corp	084-00839	    
0000027048-15-000003	asServiceCompanyTransferAgent	5	Transamerica Fund Services, Inc.	084-06130	    
0000027048-15-000003	asServiceCompanyTransferAgent	6	American Century Services, LLC	084-01406	    
0000027048-15-000003	asServiceCompanyTransferAgent	7	Morgan Stanley Services Co, Inc.	084-06270	    
0000027048-15-000003	asServiceCompanyTransferAgent	8	Leaf Financial Corporation	084-05900	    
0000027048-15-000003	asServiceCompanyTransferAgent	9	American National Stock Transfer, LLC	084-06479	    
0000027048-15-000003	asServiceCompanyTransferAgent	10	Pioneer Investment Management Shareholder Services, Inc	084-01359	    
0000027048-15-000003	serviceCompanyTransferAgent	1	Boston Financial Data Services, Inc.	084-00896	    
0000027048-15-000003	serviceCompanyTransferAgent	2	National Financial Data Services, Inc.	084-01078	    
0000027048-15-000003	serviceCompanyTransferAgent	3	DST Worldwide Services India Private Limited	084-06342	    
0001452780-15-000003	asServiceCompanyTransferAgent	1	DST Systems, Inc.	084-00448	    
0001133796-15-000022	asServiceCompanyTransferAgent	1	Deutsche Bank Trust Company Americas	085-05212	    
0001133796-15-000022	asServiceCompanyTransferAgent	2	CST Trust Company	084-06506	    
0001133796-15-000022	serviceCompanyTransferAgent	1	CST Trust Company	084-06506	    
0001352156-15-000005	asServiceCompanyTransferAgent	1	Reich & Tang Services, Inc.	084-02007	    
0001352156-15-000005	serviceCompanyTransferAgent	1	Boston Financial Data Services, Inc.	084-00896	    
0000920493-15-000002	serviceCompanyTransferAgent	1	Ultimus Fund Solutions, LLC	084-05829	    
0000817712-15-000007	serviceCompanyTransferAgent	1	DST Systems, Inc.	084-00448	    
0001571049-15-002366	asServiceCompanyTransferAgent	1	Capital Transfer Agency Inc	084-06117	    
0001571049-15-002366	asServiceCompanyTransferAgent	2	Madison Stock Transfer Inc	084-05639	    
0001571049-15-002366	asServiceCompanyTransferAgent	3	Philadelphia Stock Transfer, Inc	084-06456	    
0001571049-15-002366	asServiceCompanyTransferAgent	4	ClearTrust, LLC	084-06351	    
0000950123-15-004121	serviceCompany	1	DST Systems, Inc.	084-00448	210 W. 10th Street  Kansas City  64105
0000950123-15-004113	serviceCompanyTransferAgent	1	Columbia Management Investment Services Corp.	084-05685	    
0001022116-15-000005	asServiceCompanyTransferAgent	1	U.S. Bank Trust National Association	085-11299	    
0001022116-15-000005	asServiceCompanyTransferAgent	2	Wells Fargo Bank, N.A.	085-10133	    
0001022116-15-000005	asServiceCompanyTransferAgent	3	BOKF, National Association	085-10438	    
0001022116-15-000005	asServiceCompanyTransferAgent	4	Commerce Bank	085-10700	    
0001022116-15-000005	asServiceCompanyTransferAgent	5	Bank of America, N.A.	085-10189	    
0001022116-15-000005	asServiceCompanyTransferAgent	6	Deutsche Bank National Trust Company	085-11220	    
0001022116-15-000005	asServiceCompanyTransferAgent	7	Deutsche Bank Trust Company Americas	085-05212	    
0001022116-15-000004	serviceCompanyTransferAgent	1	U.S. Bank National Association	085-11347	    
0000019617-15-000285	asServiceCompanyTransferAgent	1	Vantagepoints Transfer Agents, LLC	084-05796	    
0000019617-15-000285	serviceCompanyTransferAgent	1	Wells Fargo Bank, NA	085-10133	    
0000019617-15-000285	serviceCompanyTransferAgent	2	Bank of New York	085-11396	    
0000019617-15-000285	serviceCompanyTransferAgent	3	U.S. Bancorp	085-11357	    
0000019617-15-000284	serviceCompanyTransferAgent	1	JP Morgan Chase Bank, NA.	085-11399	    
0000019617-15-000284	serviceCompanyTransferAgent	2	Wells Fargo Bank	085-10133	    
0001451217-15-000002	serviceCompanyTransferAgent	1	UMB Funds Services, Inc.	084-05792	    
0000838155-15-000008	serviceCompanyTransferAgent	1	Wilmington Trust Company	085-05557	    
0001458661-15-000007	serviceCompanyTransferAgent	1	Wilmington Trust Company	085-05557	    
0001458661-15-000006	asServiceCompanyTransferAgent	1	Wilmington Trust, National Association	085-11422	    
0001458661-15-000006	asServiceCompanyTransferAgent	2	Manufacturers and Traders Trust Company	085-05057	    
0000950123-15-004109	asServiceCompanyTransferAgent	1	Tri-Continental Corporation	084-00458	    
0000950123-15-004109	serviceCompanyTransferAgent	1	Boston Financial Data Services, Inc.	084-00896	    
0001144204-15-018560	serviceCompanyTransferAgent	1	DST Systems, Inc.	084-00448	    
0001144204-15-018560	serviceCompanyTransferAgent	2	Gemini Fund Services LLC	084-06083	    
0001144204-15-018558	serviceCompany	1	DST Systems, Inc.	084-00448	430 W. 7th Street  Kansas City  64105
0001144204-15-018558	serviceCompany	2	GEMINI FUND SERVICES LLC	084-06083	17605 Wright Street  OMAHA  68130
0000276398-15-000001	asServiceCompanyTransferAgent	1	OFI Global Asset Management, Inc.	084-006477	    
0000276398-15-000001	serviceCompanyTransferAgent	1	Huntington Asset Services, Inc.	084-00142	    
0001558234-15-000001	serviceCompanyTransferAgent	1	Shareholder Services Inc.	084-00907	    
0000896852-15-000004	serviceCompanyTransferAgent	1	Invesco Canada Ltd/Invesco Canada Ltee, dba Invesco Enterprise Services/Services Enterprise Invesco, and Invesco	084-06210	    
0000795029-15-000005	serviceCompanyTransferAgent	1	American Family Life Assurance Co of Columbus	084-06422	    
0000230234-15-000001	serviceCompanyTransferAgent	1	J P Morgan Trust Company	085-11351	    
0000724935-15-000004	serviceCompanyTransferAgent	1	First American Stock Transfer	084-05795	    
0000950123-15-004096	serviceCompanyTransferAgent	1	Wells Fargo	085-10133	    
0000854922-15-000002	asServiceCompanyTransferAgent	1	The Bank of New York Trust Company NA	085-11396	    
0000854922-15-000002	asServiceCompanyTransferAgent	2	BNY Mellon Trust of Delaware	085-00868	    
0000854922-15-000002	asServiceCompanyTransferAgent	3	BNY Mellon Trust Company of Illinois	085-05527	    
0000854922-15-000002	asServiceCompanyTransferAgent	4	J P Morgan Chase Bank, National Association	085-11399	    
0000854922-15-000002	serviceCompanyTransferAgent	1	BNY Mellon Investment Servicing (US) Inc.	084-01761	    
0000854922-15-000002	serviceCompanyTransferAgent	2	Computershare Inc.	084-05925	    
0000067590-15-000258	serviceCompanyTransferAgent	1	Xerox HR Solutions (formerly ACS HR Solutions, LLC)	084-06035	    
0000067590-15-000258	serviceCompanyTransferAgent	2	National Financial Services LLC	084-05888	    
0000067590-15-000258	serviceCompanyTransferAgent	3	Hewitt Associates LLC	084-01996	    
0000067590-15-000258	serviceCompanyTransferAgent	4	LPL Financial LLC	084-05637	    
0000067590-15-000258	serviceCompanyTransferAgent	5	Vanguard Group, Inc.	084-00772	    
0000067590-15-000258	serviceCompanyTransferAgent	6	Valic Retirement Services Co	084-06057	    
0000067590-15-000258	serviceCompanyTransferAgent	7	BNY Mellon Investment Servicing (U.S.) Inc	084-01761	    
0000067590-15-000258	serviceCompanyTransferAgent	8	Edward D Jones & Co LP	084-01496	    
0000067590-15-000258	serviceCompanyTransferAgent	9	Fidelity Investments Institutional Operations Co Inc	084-01839	    
0000067590-15-000258	serviceCompanyTransferAgent	10	Marshall & Ilsley Trust Co National Association	085-11354	    
0000067590-15-000258	serviceCompanyTransferAgent	11	UMB Bank NA	085-10225	    
0000067590-15-000258	serviceCompanyTransferAgent	12	Nationwide Fund Management LLC	084-00825	    
0000067590-15-000258	serviceCompanyTransferAgent	13	Wilmington Trust Co	085-05557	    
0000067590-15-000258	serviceCompanyTransferAgent	14	Wells Fargo Bank NA	085-10133	    
0001253179-15-000004	asServiceCompanyTransferAgent	1	American National Stock Transfer, LLC	084-06479	    
0001253179-15-000004	serviceCompanyTransferAgent	1	Rydex Fund Services, LLC	084-05475	    
0000950123-15-004091	serviceCompany	1	Xerox HR Solutions (formerly ACS HR Solutions, LLC)	084-06035	245 Park Avenue Floor 23 New York  10167
0000950123-15-004091	serviceCompany	2	National Financial Services, LLC	085-05888	499 Washington Blvd. 5th FL Jersey City  07310
0000950123-15-004091	serviceCompany	3	Hewitt Associates LLC	084-01996	100 Half Day Rd  Lincolnshire  60069
0000950123-15-004091	serviceCompany	4	LPL Financial LLC	084-05637	4707 Executive Drive  San Diego  92121
0000950123-15-004091	serviceCompany	5	The Vanguard Group, Inc.	084-00772	100 Vanguard Blvd.  Malvern  19355
0000950123-15-004091	serviceCompany	6	BNY Mellon Investment Servicing (U.S.) Inc.	084-01761	4400 Computer Drive  Westborough  01581
0000950123-15-004091	serviceCompany	7	Valic Retirement Services Co.	084-06057	2929 Allen Parkway L4-01  Houston  77109
0000950123-15-004091	serviceCompany	8	Edward D Jones & Co LP	084-01496	12555 Manchester Rd  St. Louis  63131
0000950123-15-004091	serviceCompany	9	Fidelity Investments Institutional Operations Co Inc	084-01839	82 Devonshire St  Boston  02109
0000950123-15-004091	serviceCompany	10	Marshall & Ilsley Trust Co National Association	085-11354	111 East Kilbourn Ave  Milwaukee  53202
0000950123-15-004091	serviceCompany	11	UMB Bank NA	085-10225	928 Grand Blvd  Kansas City  64106
0000950123-15-004091	serviceCompany	12	Wilmington Trust Co	085-05557	1100 North Market Street  Wilminton  19890
0000950123-15-004091	serviceCompany	13	Nationwide Fund Management LLC	084-00825	1000 Continental Drive Suite 400 King Of Prussia  19406
0000950123-15-004091	serviceCompany	14	Wells Fargo Bank NA	085-10133	One Montgomery St  San Francisco  94104
0000735286-15-000007	asServiceCompanyTransferAgent	1	ASCENSUS COLLEGE SAVINGS RECORDKEEPING SERVICES, LLC	084-06488	    
0000783398-15-000005	serviceCompanyTransferAgent	1	Boston Financial Data Services	084-00896	    
0000783398-15-000005	serviceCompanyTransferAgent	2	American Stock Transfer and Trust Company	084-00416	    
0000783398-15-000005	serviceCompanyTransferAgent	3	DST Systems Inc	084-00448	    
0000854890-15-000002	serviceCompanyTransferAgent	1	Citi Fund Services Ohio, Inc.	085-11408	    
0000737074-15-000002	serviceCompanyTransferAgent	1	BNY Mellon Investment Servicing (US) Inc.	084-01761	    
0000810704-15-000004	asServiceCompanyTransferAgent	1	PIONEER INVESTMENT MANAGEMENT SHAREHOLDER SERVICES INC	084-01359	    
0000810704-15-000004	asServiceCompanyTransferAgent	2	BNY Mellon Investment Servicing (US) Inc.	084-01761	    
0000810704-15-000004	asServiceCompanyTransferAgent	3	American Century Services, LLC	084-01406	    
0000810704-15-000004	asServiceCompanyTransferAgent	4	Invesco Investment Services Inc.	084-05432	    
